{
  "id": "natural-afro-rounded-coily",
  "kind": "image",
  "alt": "Fictional Black woman with a large softly rounded natural Afro showing visible coily texture and an organic perimeter.",
  "provenance": {
    "origin": "system",
    "aiGeneration": {
      "provider": "OpenAI",
      "promptKey": "natural-afro-rounded-coily"
    }
  },
  "transparentBackground": true,
  "asset": "assets/hairstyles/natural-afro-rounded-coily.png"
}
