{
  "id": "buzz-textured",
  "kind": "image",
  "alt": "Editorial reference showing a longer textured buzz silhouette.",
  "provenance": {
    "origin": "system",
    "aiGeneration": {
      "provider": "OpenAI",
      "promptKey": "buzz-textured"
    }
  },
  "transparentBackground": false,
  "asset": "assets/hairstyles/buzz-textured.png"
}
