{
  "id": "five-point-cut-geometric-dark",
  "kind": "image",
  "alt": "Fictional woman shown three-quarter view with a glossy dark geometric Five Point-style short haircut and pronounced pointed side perimeter.",
  "provenance": {
    "origin": "system",
    "aiGeneration": {
      "provider": "OpenAI",
      "promptKey": "five-point-cut-geometric-dark"
    }
  },
  "transparentBackground": true,
  "asset": "assets/hairstyles/five-point-cut-geometric-dark.png"
}
