{
  "id": "mario-balotelli-2014-liverpool",
  "kind": "image",
  "alt": "Mario Balotelli with Liverpool in September 2014 wearing a short tapered haircut.",
  "objectPosition": "50% 42%",
  "provenance": {
    "origin": "system",
    "licenseType": "licensed",
    "creator": "Egghead06",
    "licenseName": "CC BY-SA 4.0",
    "licenseUrl": "https://creativecommons.org/licenses/by-sa/4.0/",
    "attribution": "Egghead06, CC BY-SA 4.0, via Wikimedia Commons",
    "sourceUrl": "https://commons.wikimedia.org/wiki/File:Mario_Balotelli_with_Liverpool_September_2014.jpg",
    "originalUrl": "https://upload.wikimedia.org/wikipedia/commons/2/21/Mario_Balotelli_with_Liverpool_September_2014.jpg",
    "rightsEvidenceUrl": "https://commons.wikimedia.org/wiki/File:Mario_Balotelli_with_Liverpool_September_2014.jpg#Licensing",
    "rightsBasis": "Wikimedia Commons file record identifies this image as CC BY-SA 4.0.",
    "jurisdiction": "United Kingdom",
    "identifier": "Mario Balotelli with Liverpool September 2014",
    "derivativeStatus": "original"
  },
  "asset": "assets/people/mario-balotelli-2014-liverpool.jpg"
}
