{
  "id": "mario-balotelli-2019-marseille",
  "kind": "image",
  "alt": "Mario Balotelli at Olympique de Marseille in January 2019 with a small topknot.",
  "objectPosition": "50% 43%",
  "provenance": {
    "origin": "system",
    "licenseType": "licensed",
    "creator": "Bigmatbasket",
    "licenseName": "CC BY-SA 4.0",
    "licenseUrl": "https://creativecommons.org/licenses/by-sa/4.0/",
    "attribution": "Bigmatbasket, CC BY-SA 4.0, via Wikimedia Commons",
    "sourceUrl": "https://commons.wikimedia.org/wiki/File:Mario_Balotelli_OM_(cropped).jpg",
    "originalUrl": "https://upload.wikimedia.org/wikipedia/commons/8/8c/Mario_Balotelli_OM_%28cropped%29.jpg",
    "rightsEvidenceUrl": "https://commons.wikimedia.org/wiki/File:Mario_Balotelli_OM_(cropped).jpg#Licensing",
    "rightsBasis": "Wikimedia Commons file record identifies this crop as CC BY-SA 4.0.",
    "jurisdiction": "France",
    "identifier": "Mario Balotelli OM (cropped)",
    "derivativeStatus": "cropped"
  },
  "asset": "assets/people/mario-balotelli-2019-marseille.jpg"
}
