{
  "id": "twists-short",
  "kind": "image",
  "alt": "Editorial reference showing short individual two-strand twists.",
  "provenance": {
    "origin": "system",
    "aiGeneration": {
      "provider": "OpenAI",
      "promptKey": "twists-short"
    }
  },
  "transparentBackground": false,
  "asset": "assets/hairstyles/twists-short.png"
}
