{
  "id": "mario-balotelli-2012-training",
  "kind": "image",
  "alt": "Mario Balotelli at Italy's Euro 2012 training camp with a narrow mohawk.",
  "objectPosition": "50% 38%",
  "provenance": {
    "origin": "system",
    "licenseType": "licensed",
    "creator": "Piotr Drabik",
    "licenseName": "CC BY 2.0",
    "licenseUrl": "https://creativecommons.org/licenses/by/2.0/",
    "attribution": "Piotr Drabik, CC BY 2.0, via Wikimedia Commons",
    "sourceUrl": "https://commons.wikimedia.org/wiki/File:Mario_Balotelli_Euro_2012_Training.jpg",
    "originalUrl": "https://upload.wikimedia.org/wikipedia/commons/3/3e/Mario_Balotelli_Euro_2012_Training.jpg",
    "rightsEvidenceUrl": "https://commons.wikimedia.org/wiki/File:Mario_Balotelli_Euro_2012_Training.jpg#Licensing",
    "rightsBasis": "Wikimedia Commons file record identifies this image as CC BY 2.0.",
    "jurisdiction": "Poland",
    "identifier": "Mario Balotelli Euro 2012 Training",
    "derivativeStatus": "original"
  },
  "asset": "assets/people/mario-balotelli-2012-training.jpg"
}
