{
  "id": "timothee-2018-berlin",
  "kind": "image",
  "alt": "Timothée Chalamet with medium-length curls at the 2018 Toronto International Film Festival",
  "provenance": {
    "creator": "Somewhere In Toronto",
    "sourceUrl": "https://commons.wikimedia.org/wiki/File:Timoth%C3%A9e_Chalamet_in_2018_(cropped).jpg",
    "license": "CC BY-SA 2.0",
    "credit": "Somewhere In Toronto, Wikimedia Commons, CC BY-SA 2.0."
  },
  "asset": "assets/people/timothee-2018-berlin.jpg"
}
