{
  "id": "zendaya-paris-2025",
  "kind": "image",
  "alt": "Zendaya at Paris Fashion Week in September 2025 with a voluminous side-parted shoulder-length hairstyle and flipped ends.",
  "objectPosition": "50% 35%",
  "provenance": {
    "origin": "system",
    "licenseType": "licensed",
    "creator": "Itumeleng Kingsley",
    "licenseName": "CC BY 4.0",
    "licenseUrl": "https://creativecommons.org/licenses/by/4.0/",
    "attribution": "Itumeleng Kingsley, CC BY 4.0, via Wikimedia Commons",
    "sourceUrl": "https://commons.wikimedia.org/wiki/File:Zendaya_Paris_2025.jpg",
    "originalUrl": "https://upload.wikimedia.org/wikipedia/commons/5/53/Zendaya_Paris_2025.jpg",
    "rightsEvidenceUrl": "https://commons.wikimedia.org/wiki/File:Zendaya_Paris_2025.jpg#Licensing",
    "rightsBasis": "The photographer uploaded the file as own work on Wikimedia Commons and licensed it under Creative Commons Attribution 4.0 International, which permits sharing and adaptation, including commercial reuse, with attribution.",
    "derivativeStatus": "original"
  },
  "asset": "assets/people/zendaya-paris-2025.jpg"
}
